{
  "pair_id": "umcsent_spy",
  "schema_version": "1.0.0",
  "owner": "evan",
  "last_updated_by": "evan",
  "last_updated_at": "2026-10-20T13:52:27.744468+00:00",
  "indicator_axis": {
    "canonical_column": "umcsent",
    "display_name": "U. Michigan Expected Business Conditions",
    "derivatives": [
      {
        "name": "umcsent",
        "definition": "Michigan Expected Business Conditions index",
        "formula": "Data Master (UoM_ExptdChgBinesCyle)",
        "role": "raw",
        "appears_in_charts": [
          "hero"
        ]
      },
      {
        "name": "umcsent_level",
        "definition": "Index level (bounded survey index, used as is)",
        "formula": "identity",
        "role": "threshold_input",
        "appears_in_charts": [
          "hero",
          "regime_stats",
          "local_projections",
          "quantile_coef",
          "rolling_correlation",
          "granger_f_by_lag",
          "ccf_prewhitened"
        ]
      },
      {
        "name": "umcsent_diff_1m",
        "definition": "Month-on-month change",
        "formula": "x_t - x_{t-1}",
        "role": "derivative",
        "appears_in_charts": []
      },
      {
        "name": "umcsent_chg_12m",
        "definition": "12-month change",
        "formula": "x_t - x_{t-12}",
        "role": "derivative",
        "appears_in_charts": []
      },
      {
        "name": "umcsent_zscore_60m",
        "definition": "Level versus its five-year history",
        "formula": "(x - mean60)/std60",
        "role": "derivative",
        "appears_in_charts": []
      }
    ]
  },
  "target_axis": {
    "canonical_column": "spy",
    "display_name": "SPY adjusted close",
    "derivatives": [
      {
        "name": "spy",
        "definition": "SPY adjusted month-end close",
        "formula": "month-end adjusted close",
        "role": "raw",
        "appears_in_charts": [
          "hero",
          "equity_curves"
        ]
      },
      {
        "name": "spy_ret",
        "definition": "SPY monthly return",
        "formula": "spy_t / spy_{t-1} - 1",
        "role": "derivative",
        "appears_in_charts": [
          "regime_stats",
          "ccf_prewhitened"
        ]
      },
      {
        "name": "spy_fwd_1m",
        "definition": "One-month forward SPY return",
        "formula": "spy_{t+1} / spy_t - 1",
        "role": "derivative",
        "appears_in_charts": [
          "correlation_heatmap",
          "local_projections"
        ]
      },
      {
        "name": "spy_fwd_3m",
        "definition": "Three-month forward SPY return",
        "formula": "spy_{t+3} / spy_t - 1",
        "role": "derivative",
        "appears_in_charts": [
          "correlation_heatmap",
          "local_projections",
          "quantile_coef"
        ]
      },
      {
        "name": "spy_fwd_6m",
        "definition": "Six-month forward SPY return",
        "formula": "spy_{t+6} / spy_t - 1",
        "role": "derivative",
        "appears_in_charts": [
          "correlation_heatmap",
          "local_projections"
        ]
      },
      {
        "name": "spy_fwd_12m",
        "definition": "Twelve-month forward SPY return",
        "formula": "spy_{t+12} / spy_t - 1",
        "role": "derivative",
        "appears_in_charts": [
          "correlation_heatmap",
          "local_projections"
        ]
      }
    ]
  },
  "notes": "Scope limited to Michigan Expected Business Conditions signals and SPY returns."
}
