{
  "pair_id": "cement_spy",
  "schema_version": "1.0.0",
  "owner": "evan",
  "last_updated_by": "evan",
  "last_updated_at": "2026-10-18T11:32:12.222975+00:00",
  "indicator_axis": {
    "canonical_column": "cement",
    "display_name": "Portland Cement Shipments (USGS)",
    "derivatives": [
      {
        "name": "cement",
        "definition": "Portland cement shipments level (monthly)",
        "formula": "Data Master snapshot",
        "role": "raw",
        "appears_in_charts": [
          "hero"
        ]
      },
      {
        "name": "cement_yoy",
        "definition": "12-month growth",
        "formula": "100*(x_t/x_{t-12}-1)",
        "role": "derivative",
        "appears_in_charts": [
          "hero",
          "regime_stats",
          "local_projections",
          "quantile_coef",
          "rolling_correlation",
          "structural_break",
          "ccf_prewhitened",
          "granger_f_by_lag",
          "correlation_heatmap",
          "history_zoom_gfc",
          "history_zoom_covid",
          "history_zoom_inflation_2022"
        ]
      },
      {
        "name": "cement_mom",
        "definition": "1-month growth",
        "formula": "100*(x_t/x_{t-1}-1)",
        "role": "derivative",
        "appears_in_charts": [
          "correlation_heatmap"
        ]
      },
      {
        "name": "cement_3m",
        "definition": "3-month growth",
        "formula": "100*(x_t/x_{t-3}-1)",
        "role": "derivative",
        "appears_in_charts": [
          "correlation_heatmap"
        ]
      },
      {
        "name": "cement_6m",
        "definition": "6-month growth",
        "formula": "100*(x_t/x_{t-6}-1)",
        "role": "derivative",
        "appears_in_charts": [
          "correlation_heatmap",
          "equity_curves",
          "drawdown",
          "lead_plateau"
        ]
      },
      {
        "name": "cement_yoy_zscore_60m",
        "definition": "12-month growth versus its five-year history",
        "formula": "(yoy - mean60)/std60, min 36 readings",
        "role": "derivative",
        "appears_in_charts": [
          "correlation_heatmap"
        ]
      },
      {
        "name": "cement_accel",
        "definition": "Change in 12-month growth (acceleration)",
        "formula": "yoy_t - yoy_{t-1}",
        "role": "derivative",
        "appears_in_charts": [
          "correlation_heatmap",
          "ccf_prewhitened"
        ]
      }
    ]
  },
  "target_axis": {
    "canonical_column": "spy",
    "display_name": "SPY adjusted close",
    "derivatives": [
      {
        "name": "spy",
        "definition": "SPY adjusted month-end close",
        "formula": "month-end adjusted close (pinned)",
        "role": "raw",
        "appears_in_charts": [
          "hero",
          "history_zoom_gfc",
          "history_zoom_covid",
          "history_zoom_inflation_2022"
        ]
      },
      {
        "name": "spy_ret",
        "definition": "SPY monthly return",
        "formula": "spy_t / spy_{t-1} - 1",
        "role": "derivative",
        "appears_in_charts": [
          "equity_curves",
          "drawdown",
          "regime_stats",
          "ccf_prewhitened",
          "granger_f_by_lag",
          "rolling_correlation",
          "structural_break",
          "subperiod_sharpe",
          "walk_forward"
        ]
      },
      {
        "name": "spy_fwd_1m",
        "definition": "One-month forward SPY return",
        "formula": "spy_{t+1}/spy_t - 1",
        "role": "derivative",
        "appears_in_charts": [
          "correlation_heatmap",
          "local_projections"
        ]
      },
      {
        "name": "spy_fwd_3m",
        "definition": "Three-month forward SPY return",
        "formula": "spy_{t+3}/spy_t - 1",
        "role": "derivative",
        "appears_in_charts": [
          "correlation_heatmap",
          "local_projections",
          "quantile_coef"
        ]
      },
      {
        "name": "spy_fwd_6m",
        "definition": "Six-month forward SPY return",
        "formula": "spy_{t+6}/spy_t - 1",
        "role": "derivative",
        "appears_in_charts": [
          "correlation_heatmap",
          "local_projections"
        ]
      },
      {
        "name": "spy_fwd_12m",
        "definition": "Twelve-month forward SPY return",
        "formula": "spy_{t+12}/spy_t - 1",
        "role": "derivative",
        "appears_in_charts": [
          "correlation_heatmap",
          "local_projections"
        ]
      }
    ]
  },
  "notes": "Six cement growth transforms are the tournament signals (pair spec SIGNALS); the level is never traded."
}
